{
  "timestamp": "2026-07-05T12:00:00.000Z",
  "event": {
    "topic": "ems/wallbox",
    "type": "wallbox",
    "key": "wallbox:SOLAR:solar_mode:id3_on:id4_off",
    "importance": "normal",
    "status": "SOLAR",
    "status_display": "Nabíjení ze slunce",
    "reason": "solar_mode",
    "reason_display": "Dostupný přebytek z FVE",
    "human_hint": "Wallbox spustil nabíjení podle aktuálního přebytku z FVE.",
    "recommendation_hint": "Není potřeba nic dělat; nechej EMS hlídat přebytek a baterii.",
    "allowed_topics": [
      "wallbox",
      "aktuální důvod nabíjení",
      "doporučení z recommendation_hint"
    ],
    "forbidden_topics": [
      "bojler",
      "battery grid manager",
      "AC-in",
      "nouzové dobíjení"
    ],
    "notify": false,
    "speak": false,
    "silent": false
  },
  "core": {
    "ems_enabled": true,
    "battery_soc": 72,
    "pv_power": 4200,
    "surplus_power": 1600,
    "hdo_state": "VT"
  },
  "wallbox": {
    "mode": "SOLAR",
    "reason": "solar_mode",
    "reason_display": "Dostupný přebytek z FVE",
    "id3_connected": true,
    "id4_connected": false,
    "selected_car": "id3",
    "current_a": 6
  }
}
